{"candidate_id":"white-combat-0002-v1","parent_id":"W5","sha256":"7527253c6d5a4bba198e478a990443354ecf5d8cf4e1c98ace66ce50dc809497","parent_sha256":"e823e7bed219f4693aa778a838df1400c161f8e7e44001502e5bceb0ae804252",
 "changed_files":["agent_hybrid_allocator_expand.py","test_allocator_expand.py"],
 "changed_functions":["ThreatAllocator.allocate_usvs","ExpandingAllocator._under_commitment","ExpandingAllocator._released"],
 "interface_changes":[],"behavior_scope":"runtime","mechanism_card":"cards/ACE/MECHANISM_CARD.json"}
